{"run": 0, "description": "baseline", "metric_name": "frame_time_us", "metric_value": 14971, "baseline": 14971, "best_before": 14971, "status": "kept", "commit": "0dccfb2", "timestamp": "2026-03-15T00:08:32Z"}
{"run": 1, "description": "avoid per-cell String allocation in build_cell_span", "metric_name": "frame_time_us", "metric_value": 15994, "baseline": 14971, "best_before": 14971, "status": "reverted", "commit": "e07d579", "timestamp": "2026-03-15T00:14:29Z"}
{"run": 3, "description": "cache x_offset per character and avoid to_string", "metric_name": "frame_time_us", "metric_value": 16432, "baseline": 14971, "best_before": 13132, "status": "reverted", "commit": "42ca9c8", "timestamp": "2026-03-15T00:18:29Z"}
{"run": 6, "description": "skip hex color detection entirely", "metric_name": "frame_time_us", "metric_value": 10220, "baseline": 14971, "best_before": 10711, "status": "reverted", "commit": "ce5481a", "timestamp": "2026-03-15T00:24:12Z"}
{"run": 7, "description": "lazy hex color detection - only scan rows with #", "metric_name": "frame_time_us", "metric_value": 10388, "baseline": 14971, "best_before": 10711, "status": "kept", "commit": "a822a2d", "timestamp": "2026-03-15T00:25:35Z"}
{"run": 9, "description": "skip space characters in span building", "metric_name": "frame_time_us", "metric_value": 10312, "baseline": 14971, "best_before": 9989, "status": "reverted", "commit": "84923f5", "timestamp": "2026-03-15T00:28:22Z"}
{"run": 15, "description": "pre-compute mono glyph x_offset", "metric_name": "frame_time_us", "metric_value": 10249, "baseline": 14971, "best_before": 9657, "status": "reverted", "commit": "73fc813", "timestamp": "2026-03-15T00:38:31Z"}
{"run": 16, "description": "row-level Buffers with set_rich_text for per-char colors", "metric_name": "frame_time_us", "metric_value": 2271, "baseline": 14971, "best_before": 9657, "status": "kept", "commit": "083c00b", "timestamp": "2026-03-15T00:43:39Z"}
{"run": 17, "description": "apply row-level Buffer to scrollback spans", "metric_name": "frame_time_us", "metric_value": 1895, "baseline": 14971, "best_before": 2271, "status": "kept", "commit": "f2f87e3", "timestamp": "2026-03-15T00:45:21Z"}
{"run": 18, "description": "reuse span Vecs, inline total_cols, hoist cursor_info", "metric_name": "frame_time_us", "metric_value": 1406, "baseline": 14971, "best_before": 1895, "status": "kept", "commit": "940dbaa", "timestamp": "2026-03-15T00:48:58Z"}
{"run": 19, "description": "remove redundant shape_until_scroll", "metric_name": "frame_time_us", "metric_value": 1060, "baseline": 14971, "best_before": 1406, "status": "kept", "commit": "b5f7dd8", "timestamp": "2026-03-15T00:56:12Z"}
{"run": 20, "description": "skip set_size before set_rich_text", "metric_name": "frame_time_us", "metric_value": 1035, "baseline": 14971, "best_before": 1060, "status": "kept", "commit": "f4faea9", "timestamp": "2026-03-15T00:58:14Z"}
